Registro,Dispositivo,Fecha de nacimiento,Género,¿Qué tan satisfecho está con su vida actualmente?,¿Hasta qué punto siente que las cosas que hace en su vida diaria valen la pena?,"<b>Pensando en tu bienestar emocional, ¿qué tan feliz o ansioso(a) te sentiste ayer?</b>",<b>¿Qué aspecto cambiarías en Tuluá para mejorar tu bienestar y el de los demás?</b>,¿Mejorarías algo en tu Barrio?,¿En que barrio resides y que harías para mejorarlo?,Duración
2024-10-28 21:48:51,teléfono,1987-01-11,female,7,7,Feliz,Más transporte público y menos motoraton,SI,Portal de San Felipe  Más seguridad  Que haya control de equinos,01:17
2024-10-28 23:02:26,teléfono,1981-01-16,female,9,8,Feliz,Seguridad para salir hacer deporte a los alrededores,SI,Senderos de villa Liliana,01:12
2024-10-29 00:33:48,teléfono,1984-11-02,female,5,7,Neutral,Dejar trabajar a las personas que se rebuscan en la calle,SI,Tomas uribe hay muchos chirretes locos en las calles,02:08
2024-10-29 01:11:06,teléfono,1985-05-23,female,5,5,Un poco ansioso,"La inseguridad nos está matando, sino son las extorsiones, son los crímenes, o el miedo generalizado que hay en la gente, desempleo, falta de oportunidades, y a eso le sumamos la falta de cultura, especialmente en el tema del tráfico, salir en cualquier vehículo o hasta a pie es arriesgar la vida.",SI,"San Pedro Claver. Más presencia de la policía, mucho habitante de calle y robos en las casas",03:54
2024-10-29 02:05:11,teléfono,1988-09-01,female,8,9,Feliz,Traer empresa privada para así facilitar empleos,NO,"El popular, y que le cambiaría la casona",03:52
2024-10-29 05:06:08,teléfono,1959-03-29,female,10,10,Muy Feliz,"Que no hayan huecos en las calles, que los vendedores de la calle sean reubicados, que dejen trabajar los extorsionadores y que el alcalde por fin de la cara a su pueblo.",NO,El lago.,03:49
2024-10-29 07:58:16,teléfono,1974-04-05,male,9,9,Un poco ansioso,La.inseguridad,SI,Barrio AVE Cali,01:58
2024-10-29 08:46:55,teléfono,1989-07-05,female,8,8,Neutral,"Regulación y control social, incremento de la seguridad. Caminar en Tuluá es una eterna sensación de inseguridad",SI,El Palmar. Planes y programas para la ocupación del tiempo libre en los jóvenes,01:38
2024-10-29 11:56:27,teléfono,1961-09-07,female,6,7,Un poco ansioso,Más beneficios para las personas solas de la tercera edad.,NO,Nuevo principe... Nadie socializa con nadie,01:44
2024-10-29 13:22:16,teléfono,1967-04-05,male,,,Temo por mi vida,,SI,LA SEGURIDAD...TODO TULUA ESTA EN MANOS DE LA DELINCUENCIA,01:43
2024-10-29 13:38:11,teléfono,1974-10-18,female,8,8,Muy ansioso,Erradicar la extorsión y los asesinatos,SI,"La villa.   Normas claras de convivencia  0 ruido, levantar popo de mascotas",02:17
2024-10-29 13:36:46,teléfono,1948-06-20,male,10,10,Un poco ansioso,"Cultura ciudadana.  Respeto a las autoridades, a las reglas sociales, educación y cultura , respeto a los demas .",NO,Las Delicias.  Respeto a las normas de tránsito.,05:54
2024-10-29 14:11:01,teléfono,1967-03-29,female,10,10,Muy Feliz,Los consumidores de alucinogenos,SI,"Urbanización la villa , el consumo de drogas",02:14
2024-10-29 16:16:06,computer,1990-01-29,male,5,5,Un poco ansioso,"Mas Zonas Verdes, Ejemplo Boulevard del Lago, organizando la zona verde con plantas endémicas hasta la antigua terminal, generación de empleo, puede ser a través de recuperar la empresa publica o la creación de una ZF. mas espacios para la practica deportiva.",SI,"Príncipe, El parque del príncipe ya es obsoleto, se podría crear unos reductores de velocidad en este para evitar los piques que se realizan",03:16
2024-10-29 16:31:00,teléfono,1977-07-03,male,10,10,Feliz,,,,01:51
2024-10-29 18:18:38,teléfono,1959-01-17,male,4,4,Un poco ansioso,,SI,Más seguridad y controlar tanto consumidor de estupefacientes en los parques también controlar a los dueños de los perros que hacen popo y n,04:18
2024-10-29 18:25:00,teléfono,1962-12-13,female,9,9,Feliz,Seguridad,SI,ALVERNIA. Mejorar la presencia de las entidades oficiales. Aprovechar los parques para actividades culturales y restaurarlos.,07:45
2024-10-29 18:50:41,teléfono,1977-09-17,female,6,7,Un poco ansioso,Seguridad  y generacion de empleo,SI,Trinidad  -   seguridad,01:19
2024-10-29 19:06:56,teléfono,1993-01-13,female,5,5,Muy ansioso,"Empleabilidad,par auna mejor calidad de vida",NO,El victoria  Apoyo a los emprendimientos,03:24
2024-10-29 19:32:03,teléfono,1965-12-20,female,8,10,Feliz,Seguridad y programas para la gente menos favorecidas,SI,Corregimiento Nariño,01:42
2024-10-29 19:41:50,computer,2005-09-02,male,5,8,Neutral,mejores oportunidades de trabajo,SI,portales del rio  yo mejoraría la seguridad en el barrio,03:43
2024-10-29 20:38:00,teléfono,1941-10-02,male,2,9,Neutral,,SI,,02:55
2024-10-29 21:09:20,teléfono,1969-09-01,male,7,9,Neutral,"Eliminar la extorsión con más seguridad, hacer mas parques, mejorar la movilidad con mejores vías",SI,Casas huertas  no tenemos ningún parque para la familia las chatarrerías generan plagas y la ladrillera contaminación   deben ser reubicados,06:06
2024-10-29 21:18:27,teléfono,1955-07-02,male,3,6,Un poco ansioso,,SI,,00:29
2024-10-30 00:10:15,teléfono,1998-02-14,female,8,8,Un poco ansioso,"La seguridad de Tulua, más espacios de esparcimiento",SI,Aguaclara  Pavimentar toda la carrilera,01:14
2024-10-30 04:18:33,teléfono,1981-06-20,male,2,2,Un poco ansioso,Seguridad,SI,Sajonia seguridad y normalizar tarifas de servicios publicos,02:14
2024-10-30 05:02:02,teléfono,1969-09-17,female,5,5,Muy ansioso,Salir de deudas no ser más esclava de los gota gota que amenazan y cobran lo que les da la gana,SI,La Paz  espacios para capacitación  de niños jóvenes y adolescentes para que ocupen el tiempo libre,03:24
2024-10-30 07:05:53,teléfono,1986-03-16,female,9,7,Feliz,Seguridad para tener más tranquilidad,SI,"Barrio Popular, más presencia de lapolicía, se ve mucho consumidor de vicio por esta zona que viene de la casona",01:41
2024-10-30 07:01:19,teléfono,1963-07-25,female,1,3,Muy feliz,"La seguridad, respeto por el transeúnte, evitar invasión de espacio público por vendedores, vehículos (carros, motos, vendedores)",SI,"Nuevo príncipe,   falta acciones para  basuras sacadas frente a su casa, policía atienda alto volumen de equipos de sonido",08:56
2024-10-30 07:14:48,teléfono,1980-12-11,male,10,9,Neutral,"Más señalización para vehículos, tapar muchos huecos y más espacios deportivos tanto para jóvenes como para adultos.  Me falto mejorar los parques, más recipientes para depositar basura en los parques y las calles.  Esto me aria muy feliz",SI,"El estado de los parques, más señalización  Soy del barrio la esperanza de tulua",05:13
2024-10-30 07:34:43,teléfono,1968-03-13,female,5,4,Neutral,La educación desde la Flia y la manera de buscar de DIOS. Enseñamos Valores y Principios a nuestros hijos . También enseñándoles el respecto y el Temor por Dios.,SI,Barrio Rubén Cruz .  Mejoraria  el Ruido y la contaminación.  debido al alto fluido vehicular .,07:56
2024-10-30 08:07:54,teléfono,1987-06-04,female,5,7,Un poco ansioso,Cambiaría la inseguridad el temor que ya da salir a la calle y por su puesto las pocas oportunidades de empleo para las que somos mamás y queremos seguir adelante con nuestras vidas,SI,"San Antonio,mejoraría la cancha deportiva y como queda cerca el parque de los sueños,haría un control de ese parque para q dejen tanto consu",03:19
2024-10-30 10:12:07,teléfono,1965-11-01,male,10,10,Neutral,Nuestro comportamiento en las vias mas toleramcia,SI,Panamericano,11:00
2024-10-30 13:55:43,teléfono,1975-12-10,male,10,8,Feliz,La  inseguridad . No me siento seguro  en ninguna parte..,SI,En el barrio la santa cruz . Mucho consumo y venta de estupefacientes  y falta pavimentación en la parte baja del barrio.,03:24
2024-10-30 15:11:51,teléfono,1955-04-11,male,10,10,Neutral,La policia el ejército y lavdroga,SI,,01:39
2024-10-30 15:37:15,teléfono,1993-09-02,female,10,10,Feliz,Que la via hacia mategudua le hicieran mantenimiento vajo  y subo todos los días a trabajo en la escuelita de halli y cada vez más dañada la via sufre mucho los vehículos por tanta piedras y huecos y todos los que transitamos diariamente,SI,Corregimiento mategudua. Ayudar a seguir conservando la hermosa naturaleza con toda su diversidad que nos rodea,11:29